{
  "tenant_id": "11111111-1111-4111-8111-111111111111",
  "operation_id": "22222222-2222-4222-8222-222222222222",
  "attempt_id": "33333333-3333-4333-8333-333333333333",
  "hostname": "sample.one.example.test",
  "name": "Example tenant",
  "owner": {
    "sub": "44444444-4444-4444-8444-444444444444",
    "verified_email": "owner@example.com",
    "profile": {
      "first_name": "Example",
      "last_name": "Owner",
      "display_name": "Example Owner"
    }
  },
  "oidc": {
    "issuer": "https://core.example.test/oidc/tenants/11111111-1111-4111-8111-111111111111",
    "client_id": "example-client",
    "client_secret": "EXAMPLE_ONLY_NOT_A_REAL_SECRET",
    "redirect_uri": "https://sample.one.example.test/api/auth/cloud/callback/"
  }
}
